{
  "$schema": "https://json-schema.org/draft/2020-12/schema",
  "$id": "https://schemas.nexusos.dev/v1alpha2/secret-bundle-ref.schema.json",
  "title": "Encrypted secret bundle reference (v1alpha2)",
  "description": "Compact, embeddable REFERENCE to an encrypted, single-use secrets bundle whose public metadata lives in v1alpha1/secrets-bundle-manifest.schema.json. TARGET-STATE contract. It carries ONLY logical names and pointers so that a PersonalStack lock or an AssistantHandoff can point at the bundle WITHOUT inlining the manifest or any secret. It MUST NOT contain any secret value or ciphertext; the value only exists encrypted (age/X25519, ADR-0005) out of band and inside the Runtime local vault after import.",
  "x-nexus-contract-version": "v1alpha2",
  "type": "object",
  "additionalProperties": false,
  "required": ["bundle_id", "recipient", "scheme", "refs"],
  "properties": {
    "bundle_id": { "type": "string", "minLength": 8, "description": "Opaque id of the encrypted bundle this reference points at." },
    "manifest_ref": {
      "type": "string",
      "description": "Path/URL to the PUBLIC secrets-bundle-manifest (metadata only, never values)."
    },
    "recipient": {
      "type": "object",
      "additionalProperties": false,
      "required": ["instance_id", "public_key_id"],
      "description": "Instance the bundle was encrypted for. The private key never leaves the instance.",
      "properties": {
        "instance_id": { "$ref": "https://schemas.nexusos.dev/v1alpha1/common.defs.schema.json#/$defs/InstanceId" },
        "public_key_id": { "type": "string", "minLength": 1 }
      }
    },
    "scheme": {
      "const": "age",
      "description": "age/X25519 envelope encryption. Encryption only, never signing (ADR-0005)."
    },
    "refs": {
      "type": "array",
      "minItems": 1,
      "description": "Logical secret references carried by the bundle. NAMES and target services only; NEVER values.",
      "items": {
        "type": "object",
        "additionalProperties": false,
        "required": ["ref_name", "service"],
        "properties": {
          "ref_name": {
            "type": "string",
            "pattern": "^[A-Z][A-Z0-9_]*$",
            "description": "Logical reference name (e.g. ANTHROPIC_API_KEY). A NAME, not a value."
          },
          "service": { "type": "string", "minLength": 1, "description": "Provider/service the secret authenticates to." }
        },
        "not": {
          "anyOf": [
            { "required": ["value"] },
            { "required": ["secret"] },
            { "required": ["plaintext"] },
            { "required": ["ciphertext"] },
            { "required": ["api_key"] },
            { "required": ["token"] }
          ]
        }
      }
    }
  }
}
