{
  "bundle_id": "sb_personal_9d2f7a1c",
  "manifest_ref": "secrets-bundle-manifest.example.json",
  "recipient": {
    "instance_id": "inst_personal8f3a2c",
    "public_key_id": "inst-personal8f3a2c-enc-2026"
  },
  "scheme": "age",
  "refs": [
    { "ref_name": "ANTHROPIC_API_KEY", "service": "anthropic" },
    { "ref_name": "OPENAI_API_KEY", "service": "openai" }
  ]
}
